KPI,context
"6,650 كيلومترًا (4,132 ميلا)","يمتد نهر النيل على طول 6,650 كيلومترًا (4,132 ميلا)» وهو أطول نهر في إفريقيا"
زيادة تتراوح بين 2 درجة مئوية إلى 4 درجة مئوية (3.6 درجة فهرنهايت إلى 7.2 درجة فهرنهايت),ترسم التوقعات لمصر صورة مثيرة للقلق، حيث تشير التقديرات إلى زيادة تتراوح بين 2 درجة مئوية إلى 4 درجة مئوية (3.6 درجة فهرنهايت إلى 7.2 درجة فهرنهايت) بحلول نهاية القرن الحادي والعشرين
"2,830 متر مكعب في الثانية (99,500 قدم مكعب في الثانية)","بمتوسط تدفق يبلغ 2,830 متر مكعب في الثانية (99,500 قدم مكعب في الثانية)» يعد مصدرً! رئيسيًا للمياه العذبة لمصر"
"24,000 كيلومتر مربع (9,300 ميل مربع)","دلتا النيل» التي تشكلت من ترسبات النهر على مدى آلاف السنين؛ تمتد على حوالي 24,000 كيلومتر مربع (9,300 ميل مربع)؛ وهي منطقة خصبة حيوية للزراعة"
9.4 مليون كيلومتر مربع (3.6 مليون ميل مربع),تغطي الصحراء الكبرى» التي تشمل جزءًا كبيرًا من مساحة مصرء بيئة قاسية مع ندرة في الأمطار ودرجات حرارة متطرفة. هذه الصحراء الشاسعة» التي تعد أكبر صحراء حارة في العالم» تغطي حوالي 9.4 مليون كيلومتر مربع (3.6 مليون ميل مربع)
أقل من 250 مليمترًا (9.8 بوصة),يبلغ متوسط هطول الأمطار السنوي في الصحراء أقل من 250 مليمترًا (9.8 بوصة).؛ مما يخلق بيئة صعبة لمعظم أشكال الحياة
ارتفاعات تتجاوز 40 درجة مئوية (104 درجة فهرنهايت) ... انخفاضات تقل عن درجة التجمد,يمكن أن تتراوح درجات الحرارة في الصحراء من ارتفاعات تتجاوز 40 درجة مئوية (104 درجة فهرنهايت) في الصيف إلى انخفاضات تقل عن درجة التجمد في الشتاء
زيادة تتراوح بين 2 درجة مئوية إلى 4 درجة مئوية (3.6 درجة فهرنهايت إلى 7.2 درجة فهرنهايت),ترسم التوقعات لمصر صورة مثيرة للقلق» حيث تشير التقديرات إلى زيادة تتراوح بين 2 درجة مئوية إلى 4 درجة مئوية (3.6 درجة فهرنهايت إلى 7.2 درجة فهرنهايت) بحلول نهاية القرن الحادي والعشرين
